{
  "_id": "66f0a1b2c3d4e5f6a7b8c9d0",
  "schema_version": 1,
  "owner_id": "651f1c2a9b3e4d5f6a7b8c9d",
  "slug": "db-course-feedback-2026",
  "title": "数据库课程学习体验调查",
  "description": "匿名调查，用于收集对本学期数据库课程的教学反馈。",
  "status": "published",
  "allow_anonymous": true,
  "allow_multiple_responses": true,
  "opens_at": "2026-10-01T00:00:00Z",
  "closes_at": "2026-12-31T23:59:59Z",
  "current_draft_version_id": null,
  "published_version_id": "66f0a1b2c3d4e5f6a7b8c9d1",
  "last_version_no": 1,
  "published_at": "2026-10-01T00:00:00Z",
  "closed_at": null,
  "deleted_at": null,
  "created_at": "2026-09-20T09:30:00Z",
  "updated_at": "2026-10-01T00:00:00Z"
}
